{
  "schema_version": "4.0",
  "split_id": "development-catalog-v1",
  "version": 1,
  "status": "frozen",
  "policy": "Group same source, template and near duplicates before any degradation; current case remains development only",
  "assignments": [
    {
      "case_id": "case001-v2",
      "source_id": "src-authored-order-csv",
      "family_id": "fam-authored-order-csv",
      "split": "development"
    }
  ],
  "heldout_locked": false,
  "formal_ready": false,
  "reason": "Only one existing development case; no research heldout data supplied"
}
